What is the Reception phone number?,The Phone Number is 403-298-2200
What is the URL to open a new Service Desk ticket? ,Go to https://enerplus.service-now.com/ess to open a ticket
What is the old Citrix sign in page?,The old sign-in page is https://citrix.enerplus.com
Service Desk, Please Call 403-298-8800 to reach the Service Desk
Enerplus Security, Please email SecurityOps@enerplus.com
Security Operations, Please email SecurityOps@enerplus.com
How do I contact the Security team?, Please email SecurityOps@enerplus.com
